<?xml version="1.0" encoding="UTF-8" ?>
<xs:schema xmlns:xs="http://www.w3.org/2001/XMLSchema">
    <xs:element name="webs">
        <xs:complexType>
            <xs:sequence>
                <xs:element name="lenguaje" minOccurs="2" maxOccurs="unbounded">
                    <xs:complexType>
                        <xs:sequence>
                            <xs:element name="web" minOccurs="1" maxOccurs="unbounded">
                                <xs:simpleType>
                                    <xs:restriction base="xs:anyURI" />
                                </xs:simpleType>
                            </xs:element>
                        </xs:sequence>
                        <xs:attribute name="nombre" use="required">
                            <xs:simpleType>
                                <xs:restriction base="xs:string">
                                    <xs:minLength value="1" />
                                </xs:restriction>
                            </xs:simpleType>
                        </xs:attribute>
                    </xs:complexType>
                </xs:element>
            </xs:sequence>
        </xs:complexType>
    </xs:element>
</xs:schema>